{
  "schema": "strategos.elevation.v1",
  "name": "demo-ramp",
  "width": 8,
  "height": 8,
  "metresPerCell": 25,
  "origin": {
    "zone": 32,
    "band": "U",
    "easting": 500000,
    "northing": 5600000
  },
  "elevationMetres": [
    100, 105, 110, 115, 120, 125, 130, 135,
    102, 107, 112, 117, 122, 127, 132, 137,
    104, 109, 114, 119, 124, 129, 134, 139,
    106, 111, 116, 121, 126, 131, 136, 141,
    108, 113, 118, 123, 128, 133, 138, 143,
    110, 115, 120, 125, 130, 135, 140, 145,
    112, 117, 122, 127, 132, 137, 142, 147,
    114, 119, 124, 129, 134, 139, 144, 149
  ],
  "source": {
    "dataset": "synthetic",
    "licence": "CC0-1.0",
    "url": "n/a — tools/maps smoke fixture"
  }
}
